word,definition
SADZA,a type of porridge made from maize flour [n -S]
SAFER,"SAFE, secure [adj]"
SAGAS,"SAGA, a series of novels dealing with a family history [n]"
SAGER,"SAGE, wise [adj]"
SAGES,"SAGE, a garden labiate plant whose grey-green leaves are used as a flavouring, also SAULGE [n]"
SAGGY,"characterized by sagging [adj SAGGIER, SAGGIEST]"
SAILS,"SAIL, to be pushed in a boat by the wind [v]"
SAINT,"to hail as a person of exceptional holiness [v -ED, -ING, -S]"
SAIRS,"SAIR, to savour, also SAR [v]"
SAITH,"the coalfish, also SAITHE [n -S]"
SAKER,"a falcon native to Southern Europe and Asia, closely resembling the lanner [n -S]"
SAKES,"SAKE, benefit or advantage [n]"
SALAD,"a dish of green raw vegetables, also SALLAD [n -S]"
SALES,"SALE, the act of selling [n]"
SALET,"in medieval armour, a light helmet extending over the back of the neck, also SALADE, SALLET [n -S]"
SALIC,"of minerals, rich in silicon and aluminum [adj]"
SALLY,"to rush out suddenly [v SALLIED, SALLYING, SALLIES]"
SALOL,a white crystalline substance consisting of phenol salicylate [n -S]
SALON,a large room in which guests are received [n -S]
SALPA,"a free-swimming small marine animal, also SALP, SALPIAN, SALPID [n SALPAS or SALPAE]"
SALPS,"SALP, a free-swimming small marine animal, also SALPA, SALPIAN, SALPID [n]"
SALTS,"SALT, to put salt on [v]"
SALTY,"tasting of salt [adj SALTIER, SALTIEST, SALTILY]"
SALUT,an interjection expressing friendship before a drink [interj]
SALVE,"to soothe [v SALVED, SALVING, SALVES]"
SALVO,"to discharge firearms simultaneously [v SALVOED, SALVOING, SALVOES or SALVOS]"
SAMEL,"of a brick or tile, imperfectly burnt [adj]"
SAMES,"SAME, the same thing [n]"
SANDS,"SAND, to cover with a loose granular rock material [v]"
SANDY,"covered with sand [adj SANDIER, SANDIEST]"
SANED,"SANE, to make the sign of the cross on, also SAIN [v]"
SANER,"SANE, mentally sound [adj]"
SANES,"SANE, to make the sign of the cross on, also SAIN [v]"
SANKO,"a West African guitar, also SANCHO [n -S]"
SAPID,"pleasantly flavoured [adj SAPIDER, SAPIDEST]"
SAPOR,"flavour, also SAPOUR [n -S]"
SAPPY,"full of sap [adj SAPPIER, SAPPIEST, SAPPILY]"
SARAN,a thermoplastic resin [n -S]
SARDS,"SARD, a variety of quartz, also SARDIUS [n]"
SARKY,"sarcastic [adj SARKIER, SARKIEST, SARKILY]"
SASER,a device for amplifying ultrasound [n -S]
SASSY,"impertinent [adj SASSIER, SASSIEST, SASSILY] / the bark of a West African leguminous tree, used by the natives as an ordeal poison, and also medicinally, also SASSWOOD [n SASSIES]"
SATED,"SATE, to satisfy to capacity, also SATIATE [v]"
SATEM,pertaining to a group of Indo-European languages [adj]
SATES,"SATE, to satisfy to capacity, also SATIATE [v]"
SATIN,"a closely-woven silk with a lustrous and unbroken surface showing much of the warp [n -S] / to make like satin [v -ED, -ING, -S]"
SATYR,"a Greek god of the woodlands, with a tail and long ears, represented by the Romans as part goat [n -S]"
SAUCE,"to serve with a liquid dressing [v SAUCED, SAUCING, SAUCES]"
SAUCY,"impertinent [adj SAUCIER, SAUCIEST, SAUCILY]"
SAURY,"a sharp-beaked fish, like a needlefish [n SAURIES]"
SAUTS,"SAUT, to put salt on [v]"
SAVED,"SAVE, to rescue from danger, injury or loss [v]"
SAVER,one that saves [n -S]
SAVES,"SAVE, to rescue from danger, injury or loss [v]"
SAVEY,"to know, to understand, also SABE, SAVVEY, SAVVY [v -ED, -ING, -S]"
SAVIN,"a species of juniper, also SABINE, SAVINE [n -S]"
SAVOR,"to taste or smell with pleasure, also SAVOUR [v -ED, -ING, -S]"
SAVOY,a variety of cabbage [n -S]
SAVVY,"shrewd [adj SAVVIER, SAVVIEST, SAVVILY] / to understand, also SABE, SAVEY, SAVVEY [v SAVVIED, SAVVYING, SAVVIES]"
SAWED,"SAW, to cut with a jagged-edged tool [v]"
SAWER,"one who saws, also SAWYER [n -S]"
SAXES,"SAX, a chopper for trimming slate, also ZAX, ZEX [n]"
SAYER,one that says [n -S]
SAYON,a jacket [n -S]
SAYST,"SAY, to utter in words, speak [v]"
SAZES,"SAZ, a stringed instrument of the Middle East [n]"
SCABS,"SCAB, to become covered with a crust over a healing wound [v]"
SCADS,"SCAD, a kind of marine fish, aka horse-mackerel or saurel [n]"
SCAGS,"SCAG, to make a tear in cloth [v]"
SCALD,"to burn with hot liquid or steam, also SCAUD [v -ED, -ING, -S]"
SCALE,"to climb up or over [v SCALED, SCALING, SCALES]"
SCALP,"to remove the covering from the top of the skull [v -ED, -ING, -S]"
SCALY,"peeling off in flakes [adj SCALIER, SCALIEST]"
SCAMP,"to perform carelessly [v -ED, -ING, -S]"
SCAMS,"SCAM, to cheat or swindle [v]"
SCAND,"SCAN, to examine closely [v]"
SCANS,"SCAN, to examine closely [v]"
SCANT,"scarce [adj SCANTER, SCANTEST, SCANTLY] / to cut short, to spare [v -ED, -ING, -S]"
SCAPA,"to run away, leave without notice, also SCARPA, SCARPER [v -ED, -ING, -S]"
SCAPE,"to escape [v SCAPED, SCAPING, SCAPES]"
SCARE,"to frighten [v SCARED, SCARING, SCARES]"
SCARF,"a piece of cloth worn for warmth or protection [n SCARFS or SCARVES] / to cover with a scarf [v -ED, -ING, -S]"
SCARP,"to make into a steep slope [v -ED, -ING, -S]"
SCARS,"SCAR, to leave a mark of injured tissue [v]"
SCART,"to scratch, scrape, also SCRAT [v -ED, -ING, -S]"
SCARY,"frightening, also SCAREY [adj SCARIER, SCARIEST, SCARILY]"
SCATS,"SCAT, to scare away, also SCATT, SKAT [v]"
SCAUP,"to cut the scalp from [v -ED, -ING, -S]"
SCAWS,"SCAW, a low cape or headland, also SKAW [n]"
SCEND,"of a ship, to pitch into the trough of the sea, also SEND [v -ED, -ING, -S]"
SCENE,"to set in a place of action [v SCENED, SCENING, SCENES]"
SCENT,"to fill with a perfume [v -ED, -ING, -S]"
SCION,"a young member of a family, also CION, SEYEN, SIEN, SIENT, SYEN [n -S]"
SCOLD,"to rebuke harshly [v -ED, -ING, -S]"
SCONE,"a flattish, usually round or quadrant-shaped plain cake of dough, baked on a griddle or in an oven [n -S]"
SCOOP,"to lift with a spoon-like utensil [v -ED, -ING, -S]"
SCOOT,"to go quickly [v -ED, -ING, -S]"
SCOPE,"to examine with a viewing instrument [v SCOPED, SCOPING, SCOPES]"
SCORE,"to achieve a success [v SCORED, SCORING, SCORES]"
SCORN,"to treat with contempt [v -ED, -ING, -S]"
SCOUR,"to cleanse by hard rubbing [v -ED, -ING, -S]"
SCOUT,"to reconnoitre [v -ED, -ING, -S]"
SCOWL,"to frown angrily [v -ED, -ING, -S]"
SCOWS,"SCOW, to transport by flat-bottomed boat [v]"
SCRAG,"to wring the neck of [v SCRAGGED, SCRAGGING, SCRAGS]"
SCRAM,"to leave quickly [v SCRAMMED, SCRAMMING, SCRAMS]"
SCRAP,"to discard [v SCRAPPED, SCRAPPING, SCRAPS]"
SCRAT,"to scratch, also SCART [v SCRATTED, SCRATTING, SCRATS]"
SCRAY,"the tern, also SCRAYE [n -S]"
SCREE,a mass of rocks at the foot of a slope [n -S]
SCREW,"to attach with a type of metal fastener [v -ED, -ING, -S]"
SCRIM,a durable plain-woven cotton fabric [n -S]
SCRIP,a small bag; a wallet [n -S]
SCROB,"to scrape with or as with claws [v SCROBBED, SCROBBING, SCROBS]"
SCROD,"a young cod, also SCHROD [n -S]"
SCROW,a scroll [n -S]
SCRUB,"to rub hard in order to clean [v SCRUBBED, SCRUBBING, SCRUBS]"
SCRUM,"to mill around the ball in rugby [v SCRUMMED, SCRUMMING, SCRUMS]"
SCUBA,"an underwater breathing device [n -S] / to dive using scuba equipment [v -ED, -ING, -S]"
SCUDS,"SCUD, to run or move swiftly [v]"
SCULK,"to move about stealthily, also SKULK [v -ED, -ING, -S]"
SCULL,"to propel with a type of oar, also SKULL [v -ED, -ING, -S]"
SCULP,"to form an image from solid material, also SCULPT [v -ED, -ING, -S]"
SCUMS,"SCUM, to remove waste from [v]"
SCURF,scaly or shredded dry skin [n -S]
SCURS,"SCUR, to scour, search; to send skimming, also SKER, SKIRR, SQUIRR [v]"
SCUSE,"an aphetic form of excuse [v SCUSED, SCUSING, SCUSES]"
SCUTE,"a horny plate or scale, also SCUTUM [n -S]"
SCUTS,"SCUT, the tail of e.g. a rabbit [n]"
SCYES,"SCYE, an opening for the insertion of a sleeve [n]"
SEALS,"SEAL, to close or make secure [v]"
SEAME,grease; lard made from pork fat [n -S]
SEAMS,"SEAM, to join by sewing together [v]"
SEAMY,"unpleasant [adj SEAMIER, SEAMIEST]"
SEANS,"SEAN, to catch fish in a net, also SEINE [v]"
SEARS,"SEAR, to burn, also SERE [v]"
SEATS,"SEAT, to place on a chair [v]"
SECHS,"SECH, a hyperbolic secant [n]"
SECTS,"SECT, a group of people united by common beliefs [n]"
SEDAN,a type of automobile [n -S]
SEDGE,a plant like a grass but with solid stem [n -S]
SEDGY,"bordered by sedge [adj SEDGIER, SEDGIEST]"
SEEDS,"SEED, to sow a crop [v]"
SEEDY,"shabby [adj SEEDIER, SEEDIEST, SEEDILY]"
SEEKS,"SEEK, to go in search of [v]"
SEELS,"SEEL, to stitch closed the eyes of, as a falcon [v]"
SEELY,"fortunate; innocent [adj SEELIER, SEELIEST]"
SEEMS,"SEEM, to appear to be [v]"
SEEPS,"SEEP, to pass slowly through small openings [v]"
SEEPY,"oozing with water [adj SEEPIER, SEEPIEST]"
SEERS,"SEER, a prophet [n]"
SEGAR,a cigar [n -S]
SEILS,"SEIL, to strain, also SILE [v]"
SEINE,"to catch fish with a hanging net, also SEAN [v SEINED, SEINING, SEINES]"
SEISE,"to take hold of suddenly and forcibly, also SEIZE [v SEISED, SEISING, SEISES]"
SEISM,an earthquake [n -S]
SEITY,personal identity [n SEITIES]
SEIZE,"to take hold of suddenly and forcibly, also SEISE [v SEIZED, SEIZING, SEIZES]"
SELES,"SELE, happiness [n]"
SELFS,"SELF, to fertilize by the same individual [v]"
SELLS,"SELL, to give up for money [v]"
SEMEE,"in heraldry, strewn or scattered with small bearings, also SEME, SEMEED [adj]"
SEMES,"SEME, a type of heraldic pattern [n]"
SEMIE,"at Scottish universities, a second-year student [n -S]"
SENDS,"SEND, to cause to go [v]"
SENGI,a monetary unit of Zaire [n -S]
SENSE,"to have an impression or inward feeling [v SENSED, SENSING, SENSES]"
SENTE,a monetary unit of Lesotho [n LICENTE or LISENTE]
SENTI,a former monetary unit of Tanzania [n SENTI]
SEPAD,"to suppose, uphold [v SEPADDED, SEPADDING, SEPADS]"
SEPAL,one of the leaves of a calyx [n -S]
SEPIA,"a brown pigment, obtained from the ink of the cuttlefish [n -S]"
SEPIC,"of or pertaining to sepia; done in sepia; as, a sepic drawing [adj]"
SEPTS,"SEPT, a division of a tribe; a clan [n]"
SERAL,pertaining to a series of ecological changes [adj]
SERED,"SERE, to burn the surface of, also SEAR [v]"
SERER,"SERE, withered, dry, also SEAR, SEARE [adj]"
SERES,"SERE, to burn the surface of, also SEAR [v]"
SERFS,"SERF, a person in modified slavery, esp. one bound to work on the land [n]"
SERGE,a strong twilled worsted [n -S]
SERIC,silken [adj]
SERIF,"a decorative stroke at the foot of a letter, also CERIPH, SERIPH [n -S]"
SERON,"a crate, also SEROON [n -S]"
SEROW,"a Himalayan goatlike antelope, aka thar [n -S]"
SERRE,"to press close, also SERR [v SERRED, SERRING, SERRES]"
SERRS,"SERR, to press close, also SERRE [v]"
SERRY,"to press close, close the ranks of, also SERR, SERRE [v SERRIED, SERRYING, SERRIES]"
SERVE,"to work for [v SERVED, SERVING, SERVES]"
SETAL,like a bristle [adj]
SETON,a thread or the like passed through the skin as a counterirritant or for drainage [n -S]
SETTS,"SETT, a badger's home, also CETE [n]"
SETUP,the way something is arranged [n -S]
SEVEN,a number [n -S]
SEVER,"to divide or cut into parts [v -ED, -ING, -S]"
SEWAR,a medieval servant who supervised the serving of meals [n -S]
SEWED,"SEW, to mend or fasten with a needle and thread [v]"
SEWEL,"a scarecrow, a device to scare away deer, also SHEWEL [n -S]"
SEWEN,"the Welsh or Irish name for the seatrout grilse, also SEWIN [n -S]"
SEWER,"to clean or maintain underground conduits for waste [v -ED, -ING, -S]"
SEWIN,"the Welsh or Irish name for the seatrout grilse, also SEWEN [n -S]"
SEXED,"SEX, to assess organisms according to reproductive functions [v]"
SEXER,one who sexes fowls [n -S]
SEXES,"SEX, to assess organisms according to reproductive functions [v]"
SEXTS,"SEXT, to send a text message of a sexual nature [v]"
SHACK,"a roughly built cabin or hut, esp. of logs, metal sheeting, etc. [n -S] / to avoid responsibility [v -ED, -ING, -S]"
SHADE,"to screen from light or heat [v SHADED, SHADING, SHADES]"
SHADS,"SHAD, a herring-like marine fish, spawning in rivers [n]"
SHADY,"full of shade; underhand [adj SHADIER, SHADIEST, SHADILY]"
SHAFT,"to propel with a pole [v -ED, -ING, -S]"
SHAGS,"SHAG, to make shaggy [v]"
SHAKE,"to move to and fro with short, rapid movements [v SHAKED or SHOOK, SHAKEN or SHAKT, SHAKING, SHAKES]"
SHAKT,"SHAKE, to move to and fro with short, rapid movements [v]"
SHAKY,"shaking [adj SHAKIER, SHAKIEST, SHAKILY]"
SHALE,"clay rock splitting readily into thin layers along the bedding planes [n -S] / to shell, husk, also SHEAL, SHEEL, SHIEL [v SHALED, SHALING, SHALES]"
SHALL,"used as an auxiliary to express futurity, inevitability, or command [v present sing 2d person SHALL or SHALT, past sing 2d person SHOULD, SHOULDST, or SHOULDEST]"
SHALM,"an ancient oboe-like musical instrument, also SHAWM [n -S]"
SHALT,"SHALL, used as an auxiliary to express futurity, inevitability, or command [v]"
SHALY,"resembling shale, also SHALEY [adj SHALIER, SHALIEST]"
SHAME,"to cause to feel guilt [v SHAMED, SHAMING, SHAMES]"
SHAMS,"SHAM, to feign [v]"
SHANK,"to hit sharply to the right, as a golf ball [v -ED, -ING, -S]"
SHAPE,"to fashion into a form [v SHOPE or SHAPED, SHAPEN, SHAPING, SHAPES]"
SHARD,"a fragment of broken pottery, also SHAIRD, SHERD [n -S]"
SHARE,"to use in common with others [v SHARED, SHARING, SHARES]"
SHARK,"to obtain by swindling [v -ED, -ING, -S]"
SHARP,"keen, acute [adj SHARPER, SHARPEST, SHARPLY] / to raise in music by a semitone [v -ED, -ING, -S]"
SHASH,"to provide with a sash [v -ED, -ING, -ES]"
SHAUL,"to become shallow, also SHOAL [v -ED, -ING, -S]"
SHAVE,"to remove hair with a razor [v SHAVED, SHAVEN, SHAVING, SHAVES]"
SHAWL,"to wrap the shoulders in a covering [v -ED, -ING, -S]"
SHAWM,"an ancient oboe-like musical instrument, also SHALM [n -S]"
SHAYS,"SHAY, a light carriage, also CHAISE [n]"
SHEAF,"to gather into a bundle, also SHEAVE [v -ED, -ING, -S]"
SHEAL,"to shell, husk, also SHALE, SHEEL, SHIEL [v -ED, -ING, -S]"
SHEAR,"to cut the wool or hair from [v SHEARED or SHORE, SHORN, SHEARING, SHEARS]"
SHEAS,"SHEA, an African tree, from the seeds of which a substance resembling butter is obtained [n]"
SHEDS,"SHED, to cast off [v]"
SHEEN,"to shine, have a lustre [v -ED, -ING, -S]"
SHEEP,a ruminant woolgrowing mammal [n SHEEP]
SHEER,"utter [adj SHEERER, SHEEREST, SHEERLY] / to swerve, to deviate [v -ED, -ING, -S]"
SHEET,"to cover with a large piece of material [v -ED, -ING, -S]"
SHELF,"a board fixed horizontally on a wall, for putting things on [n SHELVES] / to put on a shelf, to shelve [v -ED, -ING, -S]"
SHELL,"to remove the outer covering from nuts [v -ED, -ING, -S]"
SHERD,"a fragment of broken pottery, also SHARD, SHAIRD [n -S]"
SHERO,a woman regarded as a hero [n -ES]
SHIED,"SHY, to jump aside, recoil [v]"
SHIER,"a horse that shies, also SHYER [n -S]"
SHIES,"SHY, to jump aside, recoil [v]"
SHIFT,"to move from one position to another [v -ED, -ING, -S]"
SHILL,"to act as a decoy [v -ED, -ING, -S]"
SHILY,"SHY, embarrassed, bashful [adv]"
SHIMS,"SHIM, to adjust by using a thin strip of metal or wood [v]"
SHINE,"to emit light [v SHONE or SHINED, SHINING, SHINES]"
SHINS,"SHIN, to climb by gripping with the hands and legs, also SHINNY [v]"
SHINY,"a bright object [n SHINIES] / filled with light [adj SHINIER, SHINIEST, SHINILY]"
SHIPS,"SHIP, to transport in a seagoing vessel [v]"
SHIRK,"to avoid work or a duty [v -ED, -ING, -S]"
SHIRR,"to pucker, also SHIR [v -ED, -ING, -S]"
SHIRS,"SHIR, to pucker, also SHIRR [v]"
SHIRT,"to don a garment for the upper body [v -ED, -ING, -S]"
SHIST,"a type of metamorphic rock, also SCHIST [n -S]"
SHIVE,a thin fragment [n -S]
SHIVS,"SHIV, to cut with a kind fo knife, also CHIV, CHIVE [v]"
SHOAL,"shallow, also SHAUL [adj SHOALER, SHOALEST] / to sail into shallow water [v -ED, -ING, -S]"
SHOAT,"a young pig, esp. one that has just been weaned, also SHOTE, SHOTTE [n -S]"
SHOCK,"to outrage feelings [v -ED, -ING, -S]"
SHOED,"SHOE, to provide with a covering for the foot [v]"
SHOER,one who shoes horses [n -S]
SHOES,"SHOE, to provide with a covering for the foot [v]"
SHONE,"SHINE, to emit light [v]"
SHOOK,a bundle of sheaves [n -S]
SHOON,"SHOE, a covering for the foot [n]"
SHOOS,"SHOO, to drive away [v]"
SHOOT,"to hit, injure or kill with a missile [v SHOT, SHOTTEN, SHOOTING, SHOOTS]"
SHOPE,"SHAPE, to fashion into a form [v]"
SHOPS,"SHOP, to engage in the buying of goods [v]"
SHORE,"the seaward edge of coast between low tide and effective wave action [n -S] / to prop up [v SHORED, SHORING, SHORES]"
SHORN,"SHEAR, to cut the wool or hair from [v]"
SHORT,"having little length [adj SHORTER, SHORTEST, SHORTLY] / to cause a type of electrical malfunction in [v -ED, -ING, -S]"
SHOTE,"a young pig, esp. one that has just been weaned, also SHOAT, SHOTTE [n -S]"
SHOTS,"SHOT, to load with small pellets [v]"
SHOUT,"to yell loudly [v -ED, -ING, -S]"
SHOVE,"to push roughly [v SHOVED, SHOVING, SHOVES]"
SHOWN,"SHOW, to cause or permit to be seen [v]"
SHOWS,"SHOW, to cause or permit to be seen [v]"
SHOWY,"making a brilliant display [adj SHOWIER, SHOWIEST]"
SHRED,"to cut into fine strips [v SHREDDED, SHREDDING, SHREDS]"
SHRUB,"a low woody plant smaller than a tree [n -S] / to lop; to cudgel [v SHRUBBED, SHRUBBING, SHRUBS]"
SHRUG,"to raise and contract the shoulders [v SHRUGGED, SHRUGGING, SHRUGS]"
SHUCK,"to remove husks or shells [v -ED, -ING, -S]"
SHUNS,"SHUN, to avoid [v]"
SHUNT,"to turn aside [v -ED, -ING, -S]"
SHUSH,"to hush [v SHUSHED, SHUSHING, SHUSHES]"
SHUTE,"to convey by a vertical passage, also CHUTE [v SHUTED, SHUTING, SHUTES]"
SHUTS,"SHUT, to close, also SHET [v]"
SHYER,a horse tending to shy [n -S]
SHYLY,"SHY, embarrassed, bashful [adv]"
SIALS,"SIAL, the upper layer of the continental crust, so called because it is rich in silica and aluminum oxide [n]"
SICKO,an emotionally sick person [n -S]
SICKS,"SICK, to urge to attack, also SIC [v]"
SIDED,"SIDE, to support or agree with [v]"
SIDER,a native or inhabitant of a specified district [n -S]
SIDES,"SIDE, to support or agree with [v]"
SIDLE,"to move sideways [v SIDLED, SIDLING, SIDLES]"
SIEGE,"the act or process of surrounding a town or fortress [n -S] / to subject to a siege [v SIEGED, SIEGING, SIEGES]"
SIEVE,"to pass through a strainer [v SIEVED, SIEVING, SIEVES]"
SIFTS,"SIFT, to pass through a strainer, also SIEVE [v]"
SIGHS,"SIGH, to emit a deep, audible breath [v]"
SIGHT,"to observe or notice [v -ED, -ING, -S]"
SIGNA,a verbal instruction: write on the label [v]
SIGNS,"SIGN, to write one's name [v]"
SIKES,"SIKE, a small stream, also SYKE [n]"
SILED,"SILE, to strain, also SEIL [v]"
SILEN,"a woodland god or elderly satyr, also SILENUS [n -S]"
SILER,a strainer [n -S]
SILES,"SILE, to strain, also SEIL [v]"
SILKS,"SILK, to cover with a soft lustrous fabric [v]"
SILKY,"resembling silk [adj SILKIER, SILKIEST, SILKILY]"
SILLS,"SILL, a part of a window [n]"
SILLY,"a silly person [n SILLIES] / showing a lack of common sense [adj SILLIER, SILLIEST, SILLILY]"
SILOS,"SILO, to store in a large cylindrical structure [v]"
SILTS,"SILT, to fill with a fine sediment [v]"
SILTY,"full of silt [adj SILTIER, SILTIEST]"
SIMAS,"SIMA, the oceanic crust; also the lower layer of the continental crust, so called because it is enriched in silica and magnesium oxide [n]"
SINCE,"from then until now, also SENS, SITH, SITHEN, SITHENCE, SITHENS [adv]"
SINEW,"to bind as if by sinews [v -ED, -ING, -S]"
SINGE,"to burn slightly [v SINGED, SINGEING, SINGES]"
SINGS,"SING, to utter melodious musical sounds [v]"
SINHS,"SINH, a hyperbolic function of an angle [n]"
SINKS,"SINK, to subside to a lower level [v]"
SINKY,"yielding underfoot [adj SINKIER, SINKIEST]"
SIPPY,"as in sippy cup, an infant's drinking cup [adj]"
SIRED,"SIRE, to beget [v]"
SIREN,"a device that produces a penetrating warning sound, also SYREN [n -S]"
SIRES,"SIRE, to beget [v]"
SIRUP,"a saturated solution of sugar boiled to prevent fermentation, also SYRUP [n -S] / to make into a syrup [v -ED, -ING, -S]"
SISAL,a strong fibre used for rope [n -S]
SISSY,"effeminate, also CISSY [adj SISSIER, SISSIEST] / a weak, girlish male [n SISSIES]"
SISTA,an African-American woman [n -S]
SISTS,"SIST, to stay, as judicial proceedings; to delay or suspend [v]"
SITED,"SITE, to place in position for operation [v]"
SITES,"SITE, to place in position for operation [v]"
SITKA,"as in sitka spruce, a tall North American spruce tree [adj]"
SITUP,an exercise for the stomach [n -S]
SIXER,anything counting for six [n -S]
SIXES,"SIX, a number [n]"
SIXMO,"a paper size, also SEXTO [n -S]"
SIXTH,number six in sequence [adj SIXTHLY] / one of six equal parts [n -S]
SIXTY,a number [n SIXTIES]
SIZAR,"a British student who receives financial assistance, also SIZER [n -S]"
SIZED,"SIZE, to cover with a weak gluey material [v]"
SIZEL,"metal clippings; scrap metal, also SCISSEL, SCISSIL [n -S]"
SIZER,"a student at Cambridge and Dublin, who, having passed a certain examination, is exempted from paying college fees and charges, also SIZAR [n -S]"
SIZES,"SIZE, to cover with a weak gluey material [v]"
SKATE,"to glide over ice with blades or wheels [v SKATED, SKATING, SKATES]"
SKAWS,"SKAW, a low cape or headland, also SCAW [n]"
SKEDS,"SKED, to schedule [v]"
SKEED,"SKEE, to ski [v]"
SKEES,"SKEE, to ski [v]"
SKEET,the sport of clay bird shooting [n -S]
SKEGG,"a length of keel projecting aft to protect the rudder, also SKEG [n -S]"
SKEGS,"SKEG, a length of keel projecting aft to protect the rudder, also SKEGG [n]"
SKEIN,"to wind into long, loose coils [v -ED, -ING, -S]"
SKERS,"SKER, to scour, search; to send skimming, also SCUR, SKIRR, SQUIRR [v]"
SKEWS,"SKEW, to make oblique [v]"
SKIDS,"SKID, to slide on account of a loss of traction [v]"
SKIED,"SKI, to travel over snow on narrow strips of wood, also SKEE [v]"
SKIER,one who skis [n -S]
SKIES,"SKY, to hit or throw towards the upper atmosphere [v]"
SKIEY,"resembling the sky, also SKYEY [adj SKIEYER, SKIEYEST]"
SKILL,"the ability to do something well [n -S] / to matter, to signify [v -ED, -ING, -S]"
SKIMP,"to scrimp [v -ED, -ING, -S]"
SKIMS,"SKIM, to remove floating matter from the surface [v]"
SKINS,"SKIN, to remove the natural outer covering of tissue or hide [v]"
SKINT,"having no money [adj SKINTER, SKINTEST]"
SKIPS,"SKIP, to move with light springing steps [v]"
SKIRL,"to produce a shrill sound [v -ED, -ING, -S]"
SKIRR,"to scour, search; to send skimming, also SCUR, SKER, SQUIRR [v -ED, -ING, -S]"
SKIRT,"to pass along the border [v -ED, -ING, -S]"
SKITS,"SKIT, a short satirical sketch in dramatic form [n]"
SKIVE,"to pare or split leather [v SKIVED, SKIVING, SKIVES]"
SKIVY,"inclined to slack off [adj SKIVIER, SKIVIEST]"
SKODY,"dirty, unkempt, also SCODY [adj SKODIER, SKODIEST]"
SKOGS,"SKOG, to shelter, also SCOG, SCOOG, SCOUG, SCUG, SKUG [v]"
SKORT,a pair of shorts with a front panel that gives the appearance of a skirt [n -S]
SKUAS,"SKUA, a predatory gull-like seabird [n]"
SKULL,"the framework of the head [n -S] / to propel with a type of oar, also SCULL [v -ED, -ING, -S]"
SKYED,"SKY, to hit or throw towards the upper atmosphere [v]"
SKYER,"in cricket, a hit high into the air [n -S]"
SKYEY,"like the sky; ethereal; being in the sky, also SKIEY [adj SKYIER or SKYEYER, SKYIEST or SKYEYEST]"
SLABS,"SLAB, to cover with flat, broad pieces of material [v]"
SLACK,"not tight or taut [adj SLACKER, SLACKEST, SLACKLY] / to slacken [v -ED, -ING, -S]"
SLADE,a little valley or dell [n -S]
SLAGS,"SLAG, to criticize, mock or deride [v]"
SLAID,a sledge [n -S]
SLAIN,"SLAY, to kill [v]"
SLAMS,"SLAM, to shut forcibly and noisily [v]"
SLANG,"to use extremely informal language [v -ED, -ING, -S]"
SLANK,"SLINK, to move stealthily [v]"
SLANT,"oblique [adj SLANTLY] / to deviate from the horizontal or vertical [v -ED, -ING, -S]"
SLAPS,"SLAP, to strike with the open hand [v]"
SLASH,"to cut with violent sweeping strokes [v -ED, -ING, -ES]"
SLATE,"a fine-grained argillaceous rock, also SCLATE, SKLATE [n -S] / to roof with slate [v SLATED, SLATING, SLATES]"
SLATS,"SLAT, to supply with narrow strips of wood or metal [v]"
SLATY,"resembling slate, also SLATEY [adj SLATIER, SLATIEST]"
SLAVE,"to work like a drudge [v SLAVED, SLAVING, SLAVES]"
SLAWS,"SLAW, a salad of raw shredded cabbage, also COLESLAW [n]"
SLAYS,"SLAY, to kill [v]"
SLEDS,"SLED, to transport on a wheelless structure over snow [v]"
SLEEK,"smooth, glossy [adj SLEEKER, SLEEKEST, SLEEKLY] / to make smooth, also SLEEKEN [v -ED, -ING, -S]"
SLEEP,"to be in a natural, periodic state of rest [v SLEPT, SLEEPING, SLEEPS]"
SLEET,"to shower frozen rain [v -ED, -ING, -S]"
SLEPT,"SLEEP, to be in a natural, periodic state of rest [v]"
SLEWS,"SLEW, to cause to move sideways, also SLUE [v]"
SLEYS,"SLEY, a weaver's reed [n]"
SLICE,"to cut in pieces [v SLICED, SLICING, SLICES]"
SLICK,"smooth and slippery [adj SLICKER, SLICKEST, SLICKLY] / to make slick [v -ED, -ING, -S]"
SLIDE,"to move smoothly along a surface [v SLID or SLIDED, SLIDDEN, SLIDING, SLIDES]"
SLIER,"SLY, cunning, wily; surreptitious [adj]"
SLILY,"SLY, cunning, wily; surreptitious [adv]"
SLIME,"to cover with viscous mud [v SLIMED, SLIMING, SLIMES]"
SLIMS,"SLIM, to make slim [v]"
SLIMY,"resembling slime [adj SLIMIER, SLIMIEST]"
SLING,"to throw with a sudden motion [v SLUNG, SLINGING, SLINGS]"
SLINK,"to move stealthily [v SLANK or SLINKED, SLUNK, SLINKING, SLINKS]"
SLIPE,"to peel [v SLIPED, SLIPING, SLIPES]"
SLIPS,"SLIP, to slide suddenly and accidentally [v]"
SLIPT,"SLIP, to slide suddenly and accidentally [v]"
SLITS,"SLIT, to make a long narrow cut in [v]"
SLIVE,"to slip [v SLOVE or SLIVED, SLIVEN, SLIVING, SLIVES]"
SLOBS,"SLOB, to behave in a boorish manner [v]"
SLOES,"SLOE, the fruit of the blackthorn, also SLAE [n]"
SLOGS,"SLOG, to plod [v]"
SLOMO,a slow-motion film [n -S]
SLOOM,"to slumber [v -ED, -ING, -S]"
SLOOP,a type of single-masted sailing vessel [n -S]
SLOPE,"to slant or incline [v SLOPED, SLOPING, SLOPES]"
SLOPS,"SLOP, to spill or splash [v]"
SLOPY,"sloping [adj SLOPIER, SLOPIEST]"
SLORM,"to wipe carelessly [v -ED, -ING, -S]"
SLOSH,"to move with a splashing motion [v -ED, -ING, -ES]"
SLOTH,"to be lazy [v -ED, -ING, -S]"
SLOTS,"SLOT, to cut a long narrow opening in [v]"
SLOVE,"SLIVE, to slip [v]"
SLOWS,"SLOW, to reduce speed [v]"
