word,definition
LOGIC,the science of reasoning correctly [n -S]
LOGIE,the space in front of a kiln fire [n -S]
LOGIN,"access to a mainframe or server system, also LOGON [n -S]"
LOGON,"access to a mainframe or server system, also LOGIN [n -S]"
LOIDS,"LOID, to open a lock with a strip of celluloid [v]"
LOINS,"LOIN, meat from the lower part of an animal's back [n]"
LOLLS,"LOLL, to lounge, also LOLLOP [v]"
LOLOG,"the logarithm of a logarithm, also LOGLOG [n -S]"
LOMED,"LOME, to cover with loam [v]"
LOMES,"LOME, to cover with loam [v]"
LONER,one who avoids others [n -S]
LONGE,"to guide a horse by means of a long rope [v LONGED, LONGEING, LONGES]"
LONGS,"LONG, to desire strongly [v]"
LOOBY,"a large, awkward person [n LOOBIES] / clumsy or stupid [adj LOOBIER, LOOBIEST, LOOBILY]"
LOOED,"LOO, to love, also LOU [v]"
LOOEY,"a lieutenant of the armed forces, also LOOIE, LOUIE [n -S]"
LOOKS,"LOOK, to use one's sight [v]"
LOOKY,an interjection: look at this [interj]
LOOMS,"LOOM, to appear indistinctly as in a mirage [v]"
LOONS,"LOON, a diving waterfowl [n]"
LOONY,"crazy [adj LOONIER, LOONIEST, LOONILY] / a crazy person, also LOONEY, LOONIE, LUNY [n LOONIES]"
LOOPS,"LOOP, to form oval openings [v]"
LOOPY,"full of loops [adj LOOPIER, LOOPIEST, LOOPILY]"
LOOTS,"LOOT, to plunder [v]"
LOPED,"LOPE, to run with a long stride [v]"
LOPER,one of a pair of sliding hinged pieces of metal acting as supports for e.g. a desktop [n -S]
LOPES,"LOPE, to run with a long stride [v]"
LOPPY,"hanging limply [adj LOPPIER, LOPPIEST] / a ranch handyman [n LOPPIES]"
LORAL,"pertaining to the lore, the side of a bird's head, also LOREAL [adj]"
LORAN,an acronym for long-range radio navigation system [n -S]
LORDS,"LORD, to rule over others [v]"
LORDY,a mild interjection expressing surprise [interj]
LOREL,"a good for nothing fellow; a vagabond, also LORRELL, LOSEL, LOZELL [n -S]"
LORES,"LORE, a traditional knowledge or belief [n]"
LORIC,"a leather corslet; the case of a rotifer etc., also LORICA [n -S]"
LORIS,the slender lemur of Sri Lanka [n -ES]
LORRY,a vehicle used for transportation [n LORRIES]
LOSEL,"a good for nothing fellow; a vagabond, also LOREL, LORRELL, LOZELL [n -S]"
LOSER,one who loses [n -S]
LOSES,"LOSE, to misplace or be deprived of [v]"
LOSSY,"of a compression format, losing data [adj LOSSIER, LOSSIEST]"
LOTIC,pertaining to moving water [adj]
LOTOS,"an aquatic plant, also LOTE, LOTUS [n -ES]"
LOTTO,"a game played by covering on a card each number drawn till a line of numbers is completed, also LOTO [n -S]"
LOTUS,"any of various plants, including certain waterlilies, also LOTE, LOTOS [n -ES]"
LOUMA,a weekly market in rural areas of developing countries [n -S]
LOURS,"LOUR, to look sullen or threatening, also LOWER [v]"
LOURY,"gloomy, louring, also LOWERY [adj LOURIER, LOURIEST]"
LOUSE,"to spoil or bungle [v LOUSED, LOUSING, LOUSES] / a parasitic insect [n LICE]"
LOUSY,"infested with lice [adj LOUSIER, LOUSIEST, LOUSILY]"
LOVAT,a greyish or bluish-green colour in tweed [n -S]
LOVED,"LOVE, to feel great affection for [v]"
LOVER,someone who loves [n -S]
LOVES,"LOVE, to feel great affection for [v]"
LOVEY,"fondly affectionate [adj LOVIER, LOVIEST] / a term of endearment, also LOVIE [n -S]"
LOVIE,"an endearment, love, also LOVEY [n -S]"
LOWED,"LOW, to utter the sound of cattle [v]"
LOWER,"to appear dark and threatening, also LOUR [v -ED, -ING, -S]"
LOWLY,"in a low position or rank [adj LOWLIER, LOWLIEST, LOWLILY]"
LOWNS,"LOWN, to calm, also LOUN, LOUND, LOWND, LOWNE [v]"
LOWRY,"a kind of small parrot, also LOERIE, LORY, LOURIE, LOWRIE [n LOWRIES]"
LOYAL,"faithful [adj LOYALLER or LOYALER, LOYALLEST or LOYALEST]"
LUBED,"LUBE, to lubricate [v]"
LUBES,"LUBE, to lubricate [v]"
LUCES,"LUCE, the pike or jack, a freshwater fish [n]"
LUCID,"easily understood [adj LUCIDER, LUCIDEST, LUCIDLY]"
LUCKS,"LUCK, to succeed by chance or good fortune [v]"
LUCKY,"fortunate [adj LUCKIER, LUCKIEST, LUCKILY] / an elderly woman who keeps an alehouse, also LUCKIE [n LUCKIES]"
LUCRE,sordid gain; riches [n -S]
LUDES,"LUDE, a type of sedative pill [n]"
LUDIC,aimlessly playful [adj LUDICALLY]
LUDOS,"LUDO, a simple board game played with dice and counters in which the aim is to be the first to reach a destination [n]"
LUGED,"LUGE, to race on a small sled [v]"
LUGER,one who rides a luge [n -S]
LUGES,"LUGE, to race on a small sled [v]"
LULLS,"LULL, to cause to sleep or rest [v]"
LULUS,"LULU, an outstandingly bad or impressive person or thing [n]"
LUMAS,"LUMA, a unit of currency of Armenia, also LOUMA [n]"
LUMPS,"LUMP, to make into a shapeless mass [v]"
LUMPY,"full of lumps [adj LUMPIER, LUMPIEST, LUMPILY]"
LUNAR,the distance of the moon as used for navigation [n -S]
LUNCH,"to eat a midday meal [v -ED, -ING, -ES]"
LUNES,"LUNE, a crescent-shaped figure [n]"
LUNET,a little moon or satellite [n -S]
LUNGE,"to make a sudden plunge forward [v LUNGED, LUNGEING or LUNGING, LUNGES]"
LUNGS,"LUNG, a respiratory organ [n]"
LUNKS,"LUNK, a stupid person, also LUNKHEAD [n]"
LUNTS,"LUNT, to kindle [v]"
LUPIN,"any papilionaceous plant of the genus Lupinus, also LUPINE [n -S]"
LURCH,"to roll or pitch suddenly [v -ED, -ING, -ES]"
LURED,"LURE, to attract with something desirable [v]"
LURER,one who lures [n -S]
LURES,"LURE, to attract with something desirable [v]"
LURID,"shining with a red glow or glare amid darkness [adj LURIDER, LURIDEST, LURIDLY]"
LURKS,"LURK, to lie in wait [v]"
LUSER,a user of a computer system as perceived by a technical support group [n -S]
LUSHY,"tipsy [adj LUSHIER, LUSHIEST] / a drunkard [n LUSHIES]"
LUSKS,"LUSK, to lie about lazily [v]"
LUSTS,"LUST, to have a strong sexual desire for [v]"
LUSTY,"full of vigour [adj LUSTIER, LUSTIEST, LUSTILY]"
LUTED,"LUTE, to play on the lute [v]"
LUTER,"a lute-player, also LUTANIST, LUTENIST, LUTIST [n -S]"
LUTES,"LUTE, to play on the lute [v]"
LUXED,"LUX, to clean with a vacuum cleaner [v]"
LUXES,"LUX, to clean with a vacuum cleaner [v]"
LWEIS,"LWEI, a monetary unit of Angola [n]"
LYAMS,"LYAM, a kind of bloodhound, also LYM, LYME [n]"
LYARD,"grey, dapple-grey, also LIARD, LIART, LYART [adj]"
LYART,"grey, dapple-grey, also LIARD, LIART, LYARD [adj]"
LYASE,an enzyme [n -S]
LYING,untruthful [adj LYINGLY] / the act of lying [n -S]
LYMES,"LYME, a kind of bloodhound, also LYAM, LYM [n]"
LYMPH,a body fluid containing white blood cells [n -S]
LYNCH,"to judge and put to death without legal sanction [v -ED, -ING, -ES]"
LYRES,"LYRE, an ancient harp-like instrument [n]"
LYRIC,"of poems or their authors, expressing individual or private emotions [adj] / a lyrical poem [n -S]"
LYSED,"LYSE, to cause to undergo lysis [v]"
LYSES,"LYSE, to cause to undergo lysis [v]"
LYSIN,a substance capable of disintegrating bacteria [n -S]
LYSIS,the disintegration of cells by lysins [n LYSES]
LYSSA,rabies or hydrophobia [n -S]
LYTED,"LYTE, to alight, also LITE [v]"
LYTES,"LYTE, to alight, also LITE [v]"
LYTIC,"relating to lysis, the disintegration or destruction of cells [adj LYTICALLY]"
MAAED,"MAA, to bleat like a goat [v]"
MABES,"MABE, a cultured pearl [n]"
MACAS,"MACA, a cruciferous biennial plant, native to the Peruvian Andes; the powdered root of this plant, used as a stimulant and health supplement [n]"
MACAW,"a large tropical American parrot, having a long tail and brilliant plumage [n -S]"
MACED,"MACE, to attack with a club-like weapon [v]"
MACER,an official who carries a ceremonial staff [n -S]
MACES,"MACE, to attack with a club-like weapon [v]"
MACHE,"a herb, lamb's lettuce, corn-salad [n -S]"
MACHS,"MACH, a number relating the speed of a body to the speed of sound [n]"
MACKS,"MACK, a raincoat, also MAC [n]"
MACLE,"a mineral, aka chiastolite or andalusite, so called from the tessellated appearance of a cross section [n -S]"
MACRO,"in computing, a single instruction that brings a set of instructions into operation [n -S]"
MADAM,"a courteous form of address for a woman [n -S] / to address as madam [v -ED, -ING, -S]"
MADGE,a type of hammer used in silver plating [n -S]
MADID,wet; dank [adj]
MADLY,"MAD, insane [adv]"
MAERL,calcified red seaweed; a mass of this [n -S]
MAFIC,a generally dark-colored igneous rock with significant amounts of one or more ferromagnesian minerals [n -S]
MAGES,"MAGE, a magician; a person of exceptional wisdom and learning, also MAGUS [n]"
MAGIC,"to work spells [v MAGICKED, MAGICKING, MAGICS]"
MAGMA,the molten matter from which igneous rock is formed [n MAGMAS or MAGMATA]
MAIDS,"MAID, to work as a maidservant [v]"
MAILL,a payment [n -S]
MAILS,"MAIL, to send by the government postal system [v]"
MAIMS,"MAIM, to injure or mutilate [v]"
MAINS,"MAIN, to maim or cripple [v]"
MAISE,"a measure of five hundreds of herring, also MEASE [n -S]"
MAIZE,an American cereal grass [n -S]
MAJOR,"greater [adj MAJORLY] / to pursue a specific principal course of study [v -ED, -ING, -S]"
MAKER,"one that makes, also MAKAR [n -S]"
MAKES,"MAKE, to cause to exist [v]"
MALAM,"a Muslim scholar, used as title, also MALLAM [n -S]"
MALAR,the cheekbone [n -S]
MALAX,"to soften by kneading, also MALAXATE [v -ED, -ING, -ES]"
MALES,"MALE, an individual that begets young by fertilizing the female [n]"
MALIC,"as in malic acid, an acid obtained from apple juice [adj]"
MALLS,"MALL, to beat, batter, also MAUL [v]"
MALMS,"MALM, a soft, friable limestone [n]"
MALMY,"resembling malm, a calcareous loam used in making brick [adj MALMIER, MALMIEST]"
MALTS,"MALT, to treat or combine with malt [v]"
MALTY,"resembling malt [adj MALTIER, MALTIEST]"
MALUS,"a financial penalty incurred by a trader, investor, or banker when an investment or deal results in a loss [n -ES]"
MALWA,a Ugandan drink brewed from millet [n -S]
MAMAS,"MAMA, a child's name for mother, also MAMMA, MAMMIE, MAMMY [n]"
MAMBO,"a Cuban ballroom dance resembling the rumba or cha-cha [n -S] / to dance the mambo [v -ED, -ING, -ES]"
MAMEE,"a tropical plant having an edible fruit with bright yellow pulp, also MAMEY, MAMIE, MAMMEE, MAMMEY [n -S]"
MAMEY,"a tropical plant having an edible fruit with bright yellow pulp, also MAMEE, MAMIE, MAMMEE, MAMMEY [n MAMEYS or MAMEYES]"
MAMIE,"a tropical plant having an edible fruit with bright yellow pulp, also MAMEE, MAMEY, MAMMEE, MAMMEY [n -S]"
MANAT,"a standard monetary unit of Azerbaijan, containing 100 GOPIK [n -S]"
MANEB,a powder for killing fungi [n -S]
MANED,having a mane [adj]
MANES,"MANE, the long hair that grows on the neck of some animals [n]"
MANGE,a skin disease of domestic animals [n -S]
MANGO,a tropical tree of the cashew-nut family; its yellowish-red fleshy fruit [n -ES or -S]
MANGY,"affected with mange, also MANGEY [adj MANGIER, MANGIEST, MANGILY]"
MANIA,an excessive interest or enthusiasm [n -S]
MANIC,affected by mania [adj MANICALLY] / someone affected by mania [n -S]
MANIS,another name for the pangolin [n -ES]
MANLY,"having the qualities of a man [adj MANLIER, MANLIEST, MANLILY]"
MANNA,the food miraculously provided for the Israelites in the wilderness [n -S]
MANOR,the manor house of a lord and the lands attached to it [n -S]
MANOS,"MANO, a stone roller used in Mexico etc. for grinding maize [n]"
MANSE,"a house allocated to or occupied by a minister, esp. in the Church of Scotland [n -S]"
MAPLE,a hardwood tree [n -S]
MARAS,"MARA, a large rodent, like a cavy, found in Patagonia [n]"
MARCH,"to walk in a military manner [v -ED, -ING, -ES]"
MARDY,"petulant [adj MARDIER, MARDIEST] / to behave like a spoilt child [v MARDIED, MARDYING, MARDIES]"
MARES,"MARE, a female horse [n]"
MARIA,"MARE, a female horse [n]"
MARKA,"the standard unit of currency in Bosnia-Herzegovina, also MARKKA [n MARKAS or MARAKA]"
MARKS,"MARK, to impress or stamp with a sign [v]"
MARLS,"MARL, to fertilize with a calcareous clay [v]"
MARLY,"abounding with marl [adj MARLIER, MARLIEST]"
MARMS,"MARM, a form of address to a woman, ma'am [n]"
MARRA,a Northern English dialect form of mate [n -S]
MARRY,"to enter into marriage [v MARRIED, MARRYING, MARRIES]"
MARSH,"a tract of low, wet land, also MARISH [n -ES]"
MARTS,"MART, to sell, trade [v]"
MARVY,"marvellous [adj MARVIER, MARVIEST]"
MASED,"MASE, to act as a maser, a device used to amplify long-range radar and radio astronomy signals [v]"
MASER,a device used to amplify long-range radar and radio astronomy signals [n -S]
MASES,"MASE, to act as a maser, a device used to amplify long-range radar and radio astronomy signals [v]"
MASHY,"of the nature of a mash [adj MASHIER, MASHIEST]"
MASKS,"MASK, to cover, cloak or disguise [v]"
MASON,"a person who cuts, prepares and lays stones [n -S] / to build or repair in stone [v -ED, -ING, -S]"
MASSY,"solid, full of mass [adj MASSIER, MASSIEST]"
MASTS,"MAST, to provide with a long pole that supports a ship's sails [v]"
MASTY,"as if well fed on mast [adj MASTIER, MASTIEST]"
MATCH,"to be equal to [v -ED, -ING, -ES]"
MATED,"MATE, to couple with [v]"
MATES,"MATE, to couple with [v]"
MATEY,a friend [n -S]
MATLO,"a seaman, also MATELOT, MATLOW [n -S]"
MATTE,"a molten mixture of impure metal sulphides produced during the smelting of sulphide ores of copper, nickel, etc. [n -S]"
MATTS,"MATT, a nonglossy surface, as on paint [n]"
MAUDS,"MAUD, a Scottish gray and black plaid [n]"
MAULS,"MAUL, to batter or maltreat [v]"
MAUSY,"foggy, misty, also MAUZY [adj MAUSIER, MAUSIEST]"
MAUVE,"a purple colour [n -S] / coloured mauve [adj MAUVER, MAUVEST]"
MAUZY,"foggy, misty, also MAUSY [adj MAUZIER, MAUZIEST]"
MAVIE,"the throstle or song thrush, also MAVIS [n -S]"
MAVIS,"the European throstle or song thrush, also MAVIE [n -ES]"
MAWKY,"maggoty [adj MAWKIER, MAWKIEST]"
MAWNS,"MAWN, a regional measure of capacity [n]"
MAXED,"MAX, to reach an upper limit [v]"
MAXES,"MAX, to reach an upper limit [v]"
MAXIM,"a brief expression of a general truth, principle, or rule of conduct [n -S]"
MAXIS,"MAXI, a long skirt or coat [n]"
MAYAN,"relating to maya, in Buddhist philosophy, the power to produce illusions [adj]"
MAYBE,an uncertainty [n -S]
MAYED,"MAY, to gather flowers in the spring [v]"
MAYOR,the chief executive official of a city or borough [n -S]
MAYST,"MAY, to gather flowers in the spring [v]"
MAZED,"MAZE, to bewilder [v]"
MAZER,a large drinking vessel of hardwood or metal [n -S]
MAZES,"MAZE, to bewilder [v]"
MAZEY,"winding or convoluted as a maze; confused, dizzy, also MAZY [adj MAZIER, MAZIEST, MAZILY]"
MEADS,"MEAD, an alcoholic liquor produced by fermenting a mixture of honey and water, also MEATH, MEATHE [n]"
MEALS,"MEAL, to cover with meal [v]"
MEALY,"covered with meal [adj MEALIER, MEALIEST]"
MEANS,"MEAN, to tend, signify [v]"
MEANT,"MEAN, to tend, signify [v]"
MEANY,"a nasty person, also MEANIE [n MEANIES]"
MEATS,"MEAT, animal flesh used as food [n]"
MEATY,"full of meat [adj MEATIER, MEATIEST, MEATILY]"
MEDAL,"to honour with a commemorative piece of metal [v MEDALED or MEDALLED, MEDALING or MEDALLING, MEDALS]"
MEDIC,"one engaged in medical work, also MEDICO [n -S]"
MEEDS,"MEED, a deserved reward [n]"
MEERS,"MEER, to mark off, also MEARE, MERE [v]"
MEETS,"MEET, to encounter [v]"
MEINY,"a family, including servants, etc., a retinue, also MEINEY, MEINIE, MENYIE [n MEINIES]"
MELBA,"applied to several foods named after Dame Nellie Melba (1861-1931), Australian opera singer, such as melba toast, very thin crisp toast, and melba sauce a sauce for puddings, made from raspberries [adj]"
MELDS,"MELD, to merge, blend [v]"
MELIC,"a type of perennial grass, also MELICK [n -S]"
MELON,"any of several juicy, edible gourds [n -S]"
MELTS,"MELT, to change from a solid to a liquid state by heat [v]"
MELTY,"liable to melt [adj MELTIER, MELTIEST]"
MEMES,"MEME, a practice or belief passed on other than by genes [n]"
MEMOS,"MEMO, a brief note used as a reminder [n]"
MENDS,"MEND, to repair [v]"
MENSE,"to do honour to, to grace [v MENSED, MENSING, MENSES]"
MENTO,a traditional Jamaican form of song or ballad [n -S]
MEOUS,"MEOU, to make the sound of a crying cat, also MEOW, MIAOU, MIAOW, MIAUL [v]"
MEOWS,"MEOW, to make the sound of a crying cat, also MEOU, MIAOU, MIAOW, MIAUL [v]"
MERCY,compassion and clemency [n MERCIES]
MERED,"MERE, to mark off, divide, also MEARE, MEER [v]"
MEREL,"a counter used in a game of merils, also MERELL, MERIL [n -S]"
MERER,"MERE, nothing more, nothing better [adj]"
MERES,"MERE, to mark off, divide, also MEARE, MEER [v]"
MERGE,"to combine [v MERGED, MERGING, MERGES]"
MERIL,"a counter used in a game of merils, also MEREL, MERELL [n -S]"
MERIT,"to deserve [v -ED, -ING, -S]"
MERKS,"MERK, an old Scotch silver coin [n]"
MERLE,"a blackbird, also MERL [n -S]"
MERLS,"MERL, a blackbird, also MERLE [n]"
MERRY,"mirthful, also MERRIE [adj MERRIER, MERRIEST, MERRILY] / a gean, a wild cherry [n MERRIES]"
MESAL,"in or towards the median plane, also MESIAL, MESIAN [adj MESALLY]"
MESHY,"formed like network [adj MESHIER, MESHIEST]"
MESIC,relating to a moderate supply of moisture [adj MESICALLY]
MESNE,"middle; intervening; as, in mesne lord, a lord holding an estate from a superior feudal lord [adj] / a legal intermediate [n -S]"
MESON,a short-lived subatomic particle of smaller mass than a proton [n -S]
MESSY,"dirty or untidy [adj MESSIER, MESSIEST, MESSILY]"
METAL,"any of various elementary substances with particular properties made of metal [n -S] / made of metal [adj METALLY] / to cover with metal [v METALED or METALLED, METALING or METALLING, METALS]"
METED,"METE, to distribute by measure [v]"
METER,"to measure by mechanical means, also METRE [v -ED, -ING, -S]"
METES,"METE, to distribute by measure [v]"
METHS,"METH, a stimulant drug [n]"
METOL,a coal tar derivative used in developing pictures [n -S]
METRE,"to measure by mechanical means, also METER [v METRED, METRING, METRES]"
METRO,an urban railway system running wholly or partly underground [n -S]
MEUSE,"a small hole or gap through which a wild animal passes, also MEWS, MUSET, MUSIT, SMEUSE [n -S] / to pass through a meuse [v MEUSED, MEUSING, MEUSES]"
MEWED,"MEW, of a cat, to make a high pitched cry [v]"
MEWLS,"MEWL, to cry feebly, as a kitten [v]"
MIAOU,"to make the sound of a crying cat, also MEOW, MEOU, MIAOW, MIAUL [v -ED, -ING, -S]"
MIAOW,"to make the sound of a crying cat, also MEOW, MEOU, MIAOU, MIAUL [v -ED, -ING, -S]"
MIASM,"a noxious vapor, also MIASMA [n -S]"
MIAUL,"to make the sound of a crying cat, also MEOW, MEOU, MIAOU, MIAOW [v -ED, -ING, -S]"
MICAS,"MICA, a rock-forming mineral (muscovite, biotite, lepidolite, etc.) with perfect basal cleavage [n]"
MICHE,"to play truant, also MICH, MITCH, MOOCH, MOUCH [v MICHED, MICHING, MICHES]"
MICKS,"MICK, an Irishman, also MICKY [n]"
MICKY,"an Irishman, also MICK [n MICKIES]"
MIDDY,"a medium sized beer glass, larger than a pony, smaller than a schooner, also MIDDIE [n MIDDIES]"
MIDGE,"a small gnatlike fly, esp. of the family Chironomidae [n -S]"
MIDGY,"full of midges [adj MIDGIER, MIDGIEST]"
MIDIS,"MIDI, a skirt or coat that extends to the middle of the calf [n]"
MIDST,the middle [n -S]
MIGGS,"MIGG, a type of playing marble, also MIB, MIG, MIGGLE [n]"
MIGHT,"strength, also MICHT [n -S]"
MIHIS,"MIHI, to greet ceremonially [v]"
MIKED,"MIKE, to record by use of a microphone [v]"
MIKES,"MIKE, to record by use of a microphone [v]"
MILCH,"of cattle, yielding milk [adj]"
MILDS,"MILD, to become gentle [v]"
MILER,one who runs in mile races [n -S]
MILES,"MILE, a unit of distance [n]"
MILKS,"MILK, to draw milk from the udder of [v]"
MILKY,"like milk [adj MILKIER, MILKIEST, MILKILY]"
MILLS,"MILL, to grind corn, wheat etc. [v]"
MILOS,"MILO, a drought-resistant variety of sorghum [n]"
MILTS,"MILT, to impregnate with fish sperm [v]"
MILTY,"full of milt [adj MILTIER, MILTIEST]"
MILTZ,"in Jewish cookery, the spleen [n -ES]"
MIMED,"MIME, to mimic [v]"
MIMEO,"to copy by mimeograph [v -ED, -ING, -S]"
MIMER,one that mimes [n -S]
MIMES,"MIME, to mimic [v]"
MIMIC,"to imitate [v MIMICKED, MIMICKING, MIMICS]"
MIMSY,"prim, demure, prudish, also MIM, MIMSEY [adj MIMSIER, MIMSIEST]"
MINAE,"MINA, an ancient unit of weight and value [n]"
MINAS,"MINA, an ancient unit of weight and value [n]"
MINCE,"to cut into very small pieces [v MINCED, MINCING, MINCES]"
MINCY,"affectedly dainty [adj MINCIER, MINCIEST]"
MINDS,"MIND, to heed, to look after [v]"
MINED,"MINE, to dig for valuable materials [v]"
MINER,one that mines [n -S]
MINES,"MINE, to dig for valuable materials [v]"
MINGS,"MING, to mix [v]"
MINGY,"mean and stingy [adj MINGIER, MINGIEST, MINGILY]"
MINIM,a note with the time value of half a semibreve or two crotchets [n -S]
MINIS,"MINI, something small of its type [n]"
MINKS,"MINK, a carnivorous mammal of the weasel family [n]"
MINNY,"a small fish, a minnow [n MINNIES]"
MINOR,"to study a subsidiary subject at college [v -ED, -ING, -S]"
MINTS,"MINT, to process or stamp coins [v]"
MINTY,"having the flavour of the aromatic herb mint [adj MINTIER, MINTIEST]"
MINUS,a negative quantity [n -ES]
MIRED,"MIRE, to sink in mud [v]"
MIRES,"MIRE, to sink in mud [v]"
MIREX,an insecticide [n -ES]
MIRID,a variety of leaf bug [n -S]
MIRKS,"MIRK, darkness, also MURK [n]"
MIRKY,"dark, also MURKY [adj MIRKIER, MIRKIEST, MIRKILY]"
MIRLY,"marbled [adj MIRLIER, MIRLIEST]"
MIRTH,merriness [n -S]
MISCH,"as in misch metal, an alloy of cerium and other rare earth metals, used esp. as a flint in cigarette lighters [adj]"
MISDO,"to do wrongly [v MISDID, MISDONE or MISDONNE, MISDOING, MISDOES]"
MISER,one who hoards money greedily [n -S]
MISES,"MISE, the issue in a writ of right [n]"
MISSY,"a young girl [n MISSIES] / like a miss [adj MISSIER, MISSIEST]"
MISTS,"MIST, to become blurry [v]"
MISTY,"blurry [adj MISTIER, MISTIEST, MISTILY]"
MITCH,"to play truant, also MICH, MICHE [v -ED, -ING, -ES]"
MITES,"MITE, any of various tiny arachnids of the order Acarida [n]"
MITIS,a type of wrought iron [n -ES]
MITRE,"a high, pointed headdress, cleft crosswise on top and with two ribbons hanging from the back, worn by archbishops and bishops [n -S] / to join with a mitre joint, also MITER [v MITRED, MITRING, MITRES]"
MITTS,"MITT, any of various glove-like hand coverings, such as one that does not cover the fingers, also MITTEN [n]"
MIXED,"MIX, to combine together [v]"
MIXEN,a dunghill [n -S]
MIXER,one that mixes [n -S]
MIXES,"MIX, to combine together [v]"
MIXTE,denoting a type of bicycle frame [adj]
MIXUP,a state of confusion [n -S]
MIZEN,"in a three-masted vessel, the hindmost of the fore-and-aft sails, also MIZZEN [n -S]"
MNEME,the persisting effect of the memory of past events [n -S]
MOANS,"MOAN, to utter a low, mournful sound, also MEANE, MEIN, MENE [v]"
MOATS,"MOAT, to surround with a water-filled trench [v]"
MOCHA,"a choice, pungent coffee [n -S]"
MOCKS,"MOCK, to ridicule [v]"
MODAL,related to mood [adj MODALLY] / a modal auxiliary [n -S]
MODEL,"to form a plan or design [v MODELED or MODELLED, MODELING or MODELLING, MODELS]"
MODEM,"to transmit by electronic device [v -ED, -ING, -S]"
MODES,"MODE, a way or manner of acting [n]"
MOGGY,"a cat, also MOGGIE [n MOGGIES]"
MOHOS,"MOHO, a boundary separating the earth's crust and the mantle [n]"
MOILE,a type of rice pudding made with almond milk [n -S]
MOILS,"MOIL, to drudge, work hard [v]"
MOIST,"slightly wet [adj MOISTER, MOISTEST, MOISTLY] / to wet slightly [v -ED, -ING, -S]"
MOJOS,"MOJO, a magic charm [n]"
MOKES,"MOKE, a donkey [n]"
MOLAL,"relating to a mole, a molecular weight [adj]"
MOLAR,a grinding tooth [n -S]
MOLAS,"MOLA, a brightly-coloured applique or embroidered panel made by Cuna Indian women of Panama [n]"
MOLDS,"MOLD, to work into a particular shape, also MOULD [v]"
MOLDY,"mouldy [adj MOLDIER, MOLDIEST]"
MOLED,"MOLE, to elicit bit by bit [v]"
MOLES,"MOLE, the quantity of a compound that has a weight equal to the compound's molecular weight [n]"
MOLLS,"MOLL, a gangster's girlfriend [n]"
MOLLY,a kind of tropical fish [n MOLLIES]
MOLTS,"MOLT, to shed feathers or fur, also MOULT [v]"
MOLYS,"MOLY, a magical herb given by Hermes to Odysseus against the charms of Circe; a species of wild onion [n]"
MONAD,"the number one; a unit; a single-celled organism, also MONAS [n MONADS or MONADES]"
MONAS,"the number one; a unit; a single-celled organism, also MONAD [n MONADES or MONASES]"
MONDO,a Zen Buddhism question and answer technique [n -S]
MONER,"a hypothetical simplest protozoan, the organism on which Hackel's version of the evolution theory is based, also MONERAN, MONERON [n MONERA]"
MONEY,an official medium of exchange and measure of value [n MONEYS or MONIES]
MONGO,"the waste produced in a woollen-mill from felted cloth, also MUNGO, MONGOE [n -ES or -S]"
MONIC,denoting a type of polynomial [adj]
MONKS,"MONK, a man who is a member of a religious order [n]"
MONOS,"MONO, the black howler monkey of Central America [n]"
MONTH,"one of the twelve conventional divisions of the year, or its length, also MONETH [n -S]"
MONTY,"the whole lot, as in the phrase 'the full monty' [n MONTIES]"
MOOBS,"overdeveloped breasts on a man, caused by excess weight or lack of exercise, also MOOBIES [n]"
MOOCH,"to play truant, also MICH, MICHE, MITCH, MOUCH [v -ED, -ING, -ES]"
MOODS,"MOOD, a temporary state of the emotions or attitude [n]"
MOODY,"given to changing attitudes [adj MOODIER, MOODIEST, MOODILY] / to persuade by flattery [v MOODIED, MOODYING, MOODIES]"
MOOED,"MOO, to make the sound of a cow [v]"
MOOKS,"MOOK, a book produced in magazine format [n]"
MOOLI,an East African vegetable like a radish [n -S]
MOOLY,"a hornless cow, also MULEY, MOOLEY, MULLEY [n MOOLIES]"
MOONG,"as in moong bean, a kind of bean [adj]"
MOONS,"MOON, to wander about listlessly [v]"
MOONY,"resembling the moon, dreamy [adj MOONIER, MOONIEST, MOONILY] / a simpleton [n MOONIES]"
MOORS,"MOOR, to secure a vessel by cable or anchor [v]"
MOORY,"of or pertaining to moors [adj MOORIER, MOORIEST]"
MOOSE,a large deer found in Canada [n MOOSE]
MOOTS,"MOOT, to bring up for discussion [v]"
MOPED,a type of motorbike [n -S]
MOPER,one who mopes [n -S]
MOPES,"MOPE, to be listless or depressed [v]"
MOPEY,"dejected, also MOPY [adj MOPIER, MOPIEST]"
MOPSY,a woman who wears dowdy clothes [n MOPSIES]
MORAT,a drink made of honey and flavoured with mulberries [n -S]
MORAY,"a kind of eel, also MURRAY, MURREY, MURRY [n -S]"
